{
  "schemaVersion": "2.0.0",
  "planId": "2026-09-21_sunday-addition_2026-09-27",
  "status": "confirmed",
  "period": {
    "label": "Sunday 27 September meals",
    "startDate": "2026-09-21",
    "endDate": "2026-09-27",
    "timezone": "Europe/London"
  },
  "household": [
    {
      "id": "marcus",
      "name": "Marcus",
      "type": "adult"
    },
    {
      "id": "bron",
      "name": "Bron",
      "type": "adult"
    },
    {
      "id": "barney",
      "name": "Barney",
      "type": "child"
    }
  ],
  "days": [
    {
      "date": "2026-09-21",
      "dayName": "Monday",
      "mealIds": [],
      "notes": [
        "Elapsed day — not included in this four-day plan."
      ]
    },
    {
      "date": "2026-09-22",
      "dayName": "Tuesday",
      "mealIds": [
        "tue-dinner-honey-lemon-chicken"
      ]
    },
    {
      "date": "2026-09-23",
      "dayName": "Wednesday",
      "mealIds": [
        "wed-lunch-honey-lemon-chicken",
        "wed-dinner-beef-rigatoni"
      ]
    },
    {
      "date": "2026-09-24",
      "dayName": "Thursday",
      "mealIds": [
        "thu-lunch-beef-rigatoni",
        "thu-dinner-sticky-pork-noodles"
      ],
      "notes": [
        "Barney eats dinner at nursery."
      ]
    },
    {
      "date": "2026-09-25",
      "dayName": "Friday",
      "mealIds": [
        "fri-lunch-sticky-pork-noodles",
        "fri-dinner-ginger-coconut-chicken"
      ]
    },
    {
      "date": "2026-09-26",
      "dayName": "Saturday",
      "mealIds": [],
      "notes": [
        "No food planned — plan ends Friday."
      ]
    },
    {
      "date": "2026-09-27",
      "dayName": "Sunday",
      "mealIds": [
        "sun-lunch-jacket-beans-cheddar",
        "sun-dinner-roast-chicken"
      ],
      "notes": [
        "Sunday standalone lunch and roast dinner. Today's shopping list covers only these meals."
      ]
    }
  ],
  "meals": {
    "tue-dinner-honey-lemon-chicken": {
      "id": "tue-dinner-honey-lemon-chicken",
      "date": "2026-09-22",
      "title": "Honey, lemon & garlic chicken rice bowls with spinach, tomato, lettuce & tahini-yogurt sauce",
      "cuisine": "Mediterranean-inspired",
      "slotLabel": "Dinner",
      "mealMode": "cook",
      "portions": {
        "adultServings": 4,
        "childServings": 1,
        "allocation": [
          "Marcus Tuesday dinner",
          "Bron Tuesday dinner",
          "Barney Tuesday dinner",
          "2 complete adult Wednesday lunches"
        ]
      },
      "method": [
        "Cook the rice and divide it across five portions.",
        "Mix honey, mustard, zest and juice of half the lemon, crushed garlic and olive oil. Coat the chicken and cook in a hot pan until well browned and cooked through.",
        "Wilt the spinach briefly. Chop the tomatoes, lettuce and red onion for a fresh salad.",
        "Loosen yogurt and tahini with the remaining lemon juice and a little water.",
        "Build every bowl with rice, chicken, spinach, salad and tahini-yogurt sauce. Box two complete adult portions before serving."
      ],
      "ingredients": [
        {
          "item": "Chicken breast",
          "quantity": 600,
          "unit": "g"
        },
        {
          "item": "Dry rice",
          "quantity": 300,
          "unit": "g"
        },
        {
          "item": "Spinach",
          "quantity": 120,
          "unit": "g"
        },
        {
          "item": "Large salad tomatoes",
          "quantity": 2,
          "unit": "each"
        },
        {
          "item": "Lettuce",
          "quantity": 1,
          "unit": "half head"
        },
        {
          "item": "Red onion",
          "quantity": 0.5,
          "unit": "each"
        },
        {
          "item": "Natural yogurt",
          "quantity": 150,
          "unit": "g"
        },
        {
          "item": "Tahini",
          "quantity": 35,
          "unit": "g"
        },
        {
          "item": "Honey",
          "quantity": 2,
          "unit": "tbsp"
        },
        {
          "item": "Mustard",
          "quantity": 1,
          "unit": "tbsp"
        },
        {
          "item": "Lemon",
          "quantity": 1,
          "unit": "each"
        },
        {
          "item": "Garlic",
          "quantity": 3,
          "unit": "cloves"
        },
        {
          "item": "Olive oil",
          "quantity": 1,
          "unit": "tbsp"
        }
      ],
      "flavourNote": "Brown the chicken properly so the honey caramelises; the lemon and mustard should keep the glaze sharp rather than sweet, while tahini-yogurt adds richness.",
      "barneyNote": "Keep his chicken lightly seasoned, cut small, and serve salad components in manageable pieces.",
      "storageNote": "Chill the two complete Wednesday lunch bowls promptly; reheat chicken, rice and spinach until piping hot and add cold salad/sauce after heating.",
      "arrangeForLunch": {
        "enabled": true,
        "portions": 2,
        "for": "2026-09-23",
        "label": "2 complete adult portions for Wednesday lunch",
        "instructions": "Reserve rice, chicken, spinach, salad and tahini-yogurt sauce for each lunch."
      }
    },
    "wed-lunch-honey-lemon-chicken": {
      "id": "wed-lunch-honey-lemon-chicken",
      "date": "2026-09-23",
      "title": "Honey, lemon & garlic chicken rice bowls with spinach, tomato, lettuce & tahini-yogurt sauce",
      "cuisine": "Mediterranean-inspired",
      "slotLabel": "Lunch",
      "mealMode": "planned_leftover",
      "portions": {
        "adultServings": 2,
        "childServings": 0,
        "allocation": [
          "Marcus lunch",
          "Bron lunch"
        ]
      },
      "method": [
        "Reheat the rice, chicken and spinach until piping hot; add the reserved salad and tahini-yogurt sauce after heating."
      ],
      "storageNote": "Prepared deliberately Tuesday night and chilled promptly.",
      "sourceMealId": "tue-dinner-honey-lemon-chicken",
      "arrangedFromPreviousMeal": {
        "sourceMealId": "tue-dinner-honey-lemon-chicken",
        "label": "Exact complete meal prepared from previous dinner"
      }
    },
    "wed-dinner-beef-rigatoni": {
      "id": "wed-dinner-beef-rigatoni",
      "date": "2026-09-23",
      "title": "Beef, courgette & carrot rigatoni in rich tomato-basil sauce with Parmesan",
      "cuisine": "Italian",
      "slotLabel": "Dinner",
      "mealMode": "cook",
      "portions": {
        "adultServings": 4,
        "childServings": 1,
        "allocation": [
          "2 adult Wednesday dinners",
          "Barney Wednesday dinner",
          "2 complete adult Thursday work lunches"
        ]
      },
      "method": [
        "Cook the rigatoni 1–2 minutes short of the packet time.",
        "Brown the beef mince hard in olive oil. Add diced onion, grated carrot and diced courgette; cook until softened and starting to colour.",
        "Add garlic, both tins of chopped tomatoes and the chopped fresh tomato. Simmer uncovered for 15–20 minutes until thick and rich.",
        "Stir through most of the basil and half the Parmesan, then combine with the rigatoni. Finish with the remaining Parmesan and basil.",
        "Box two complete adult portions before serving."
      ],
      "ingredients": [
        {
          "item": "Beef mince",
          "quantity": 500,
          "unit": "g"
        },
        {
          "item": "Dry rigatoni",
          "quantity": 400,
          "unit": "g"
        },
        {
          "item": "Chopped tomatoes",
          "quantity": 2,
          "unit": "400g tins"
        },
        {
          "item": "Courgette",
          "quantity": 1,
          "unit": "each"
        },
        {
          "item": "Carrot",
          "quantity": 1,
          "unit": "each"
        },
        {
          "item": "Large salad tomato",
          "quantity": 1,
          "unit": "each"
        },
        {
          "item": "Brown onion",
          "quantity": 1,
          "unit": "each"
        },
        {
          "item": "Garlic",
          "quantity": 4,
          "unit": "cloves"
        },
        {
          "item": "Fresh basil",
          "quantity": 1,
          "unit": "30g pack"
        },
        {
          "item": "Parmesan",
          "quantity": 100,
          "unit": "g"
        },
        {
          "item": "Olive oil",
          "quantity": 1,
          "unit": "tbsp"
        }
      ],
      "flavourNote": "The key is deep browning on the beef and a properly reduced tomato sauce; Parmesan and basil provide umami and freshness rather than relying on sweetness.",
      "barneyNote": "Remove his portion before extra salt and pepper; grate the vegetables finely and cut pasta if needed.",
      "storageNote": "Cool and chill two complete portions promptly; reheat once until piping hot.",
      "arrangeForLunch": {
        "enabled": true,
        "portions": 2,
        "for": "2026-09-24",
        "label": "2 complete adult portions for Thursday lunch",
        "instructions": "Reserve complete portions of beef-and-vegetable rigatoni with sauce and Parmesan."
      }
    },
    "thu-lunch-beef-rigatoni": {
      "id": "thu-lunch-beef-rigatoni",
      "date": "2026-09-24",
      "title": "Beef, courgette & carrot rigatoni in rich tomato-basil sauce with Parmesan",
      "cuisine": "Italian",
      "slotLabel": "Lunch",
      "mealMode": "planned_leftover",
      "portions": {
        "adultServings": 2,
        "childServings": 0,
        "allocation": [
          "Marcus lunch",
          "Bron lunch"
        ]
      },
      "method": [
        "Reheat the complete rigatoni portions until piping hot."
      ],
      "storageNote": "Prepared deliberately Wednesday night and chilled promptly.",
      "sourceMealId": "wed-dinner-beef-rigatoni",
      "arrangedFromPreviousMeal": {
        "sourceMealId": "wed-dinner-beef-rigatoni",
        "label": "Exact complete meal prepared from previous dinner"